reviewId,userName,userImage,content,score,thumbsUpCount,reviewCreatedVersion,at,replyContent,repliedAt,sortOrder,appId
ac7ea621-0963-465a-ad37-a517911e7f9f,antonia santos,https://play-lh.googleusercontent.com/a-/AD5-WCkO1FgcPrE2Dq9AVEbus6L6b8cX6dnd4Ecx3mYFUw,"O app tá uma porct, não consigo abrir a sacola de comprar, fica aparecendo uma mensagem que está sem conexão com a internet, sendo que a internet está normal.",3,0,3.81.0,2022-12-16 17:39:50,"Oi, antonia. Sentimos por issomuito ! Peço para que entre em contato com nosso time através deste link 👉(https://maga.lu/atendimento), é só copiar o mesmo e colar em seu navegador. Que lá eles vão te ajudar, ok?!",2022-12-18 12:16:49,most_relevant,com.luizalabs.mlapp
d463f64c-cc39-42e6-b8ae-521d8357584e,Railton Melo,https://play-lh.googleusercontent.com/a/AEdFTp7er2ht11dS1p0TmoMMnlRjWA8xCoTqc5RX4A3M=mo,"Não estou conseguindo fazer loguin em 2 contas no celular Samsung s8. As duas contas que utilizo, quando vou fazer loguin aparece Ocorreu um erro inesperado! E entro no site parceiro magalu e consigo fazer esse loguin!",3,0,3.81.0,2022-11-25 11:56:59,"Oi, Railton. Sentimos muito por isso! Peço para que entre em contato com nosso time através deste link 👉(https://maga.lu/atendimento), é só copiar o mesmo e colar em seu navegador. Que lá eles vão te ajudar, ok?!",2022-11-25 14:48:55,most_relevant,com.luizalabs.mlapp
0ffd7282-06ee-4e5e-9f52-49d46520b1d9,Salomao Bezerra,https://play-lh.googleusercontent.com/a/AEdFTp6UXzhQHowK6EYWPPNgOU4m3tUoDrJtclNJZiD1=mo,"O app está tendo vários erros, não consigo ver os produtos que comprei , e da erro na conexão com a internet, sendo que está conectado a uma internet boa . Por favor resolvam isso.",3,2,3.79.0,2022-10-11 17:17:45,"Oi, Salomao. Sinto muito por isso. 😕 Dê uma olhadinha se o SuperApp Magalu está atualizado, caso sim, tente fazer a limpeza de cash. A memória cash são arquivos temporários que ficam armazenados no celular quando algum app é acessado. Se o problema continuar envie um e-mail pro atendimento.site@magazineluiza.com.br 😉 Magalu - Compras Online",2022-10-13 13:23:25,most_relevant,com.luizalabs.mlapp
712e2efd-bf24-4d2e-9001-98bbfbf239de,Maria Antonia Zaguete,https://play-lh.googleusercontent.com/a-/AD5-WCmV9Pdk7vuIHLZMD11aIFJjBsY6Hng4BYtBAsXeXnM,"Eu já sou cliente ouro e faiz muitos anos, antigamente tinha opção de comprar em 15 ou 18 ou 24 vezes agora não existe mais essas opções que é uma pena porque vamos comprar em outras lojas. E o produto estão muito caro comparado com outras lojas o frete também caríssimo, vamos procurar melhor Oferta e é frete com preço bom adequado pra todos nós 💞 💞 💞 💞 💞 💞 💞 💞",3,2,3.80.0,2022-10-29 13:28:15,"Oi, Maria. Sentimos muito por isso! Peço para que entre em contato com nosso time através deste link 👉(https://maga.lu/atendimento), é só copiar o mesmo e colar em seu navegador. Que lá eles vão te ajudar, ok?!",2022-10-30 17:17:13,most_relevant,com.luizalabs.mlapp
79951b43-819a-4a49-a55e-1e64c25e4f3a,irani conceição,https://play-lh.googleusercontent.com/a-/AD5-WCmH0BT-aYuCfiI9wK1AUqlKuqP39PN4g6RHGk7f,"Bom dia Preciso dar uma entrada no pix e pagar o restante no cartão.mas não encontrei essa opção. Ou comprar em dois cartões de crédito, também não encontrei essa opção. Obrigada Aguardo resposta",3,3,3.79.0,2022-10-04 11:42:50,"Oi, irani. Peço para que entre em contato com nosso time através deste link 👉(https://maga.lu/atendimento), é só copiar o mesmo e colar em seu navegador. Que lá eles vão te ajudar, ok?!",2022-10-04 11:53:59,most_relevant,com.luizalabs.mlapp
379153d3-b3b9-46c6-867e-74b7f7743f0f,odalmis tablada,https://play-lh.googleusercontent.com/a-/AD5-WClrpsYWCtZDHRCNJwh800c_4o8xQJYAEFpdNLQW6g,"Minha experiência na loja Magazine foi ótima mas agora desde que começarám com o negócio de trabalhar com lojas parceiras a Magazine perdeu credibilidade , tenho 2 produtos que comprei em loja parceira e um produto era pra ter chegado no dia 03/10, e até agora nada de chegar, já cansei de ligar para a Magazine e eles falam que tem que esperar resposta da loja parceira. Outro produto apareceu ontem como entregue no meu endereço e aqui nunca chegou, liguei pra eles, e a mesma história.",3,2,3.79.0,2022-10-12 20:35:38,"Oi, odalmis. Sentimos muito por isso! Peço para que entre em contato com nosso time através deste link 👉(https://maga.lu/atendimento), é só copiar o mesmo e colar em seu navegador. Que lá eles vão te ajudar, ok?!",2022-10-13 14:28:42,most_relevant,com.luizalabs.mlapp
cdb27f64-fb44-45f9-b1b0-cc764dbcba18,Haroldo Batista (Dodo),https://play-lh.googleusercontent.com/a-/AD5-WClXK0qSi-CAZ0_7QXcLvuiM5keX_Ra88dgrw0cJOvw,"Infelizmente não dá para comprar no site Magalu. A qualidade dos produtos parceiros da Magalu, estão péssimas e o atendimento deixa muito a desejar. E para trocar ou devolver o pagamento é uma tortura.",3,2,3.79.0,2022-10-15 19:05:36,"Oi, Haroldo. Sentimos muito por isso! Peço para que entre em contato com nosso time através deste link 👉(https://maga.lu/atendimento), é só copiar o mesmo e colar em seu navegador. Que lá eles vão te ajudar, ok?!",2022-10-16 12:03:59,most_relevant,com.luizalabs.mlapp
0a9445b5-a5c4-4e1b-a6d7-883e7ecef6fa,Assucena Montheles,https://play-lh.googleusercontent.com/a-/AD5-WCk54bRAkJOKqgpaToIl2M6wjEwiCLB5viN0oFkwXz8,Só achei ruim porque fiz a compra passou muito do dia e a mercadoria não chegou e quando fiz o cancelamento fecharam o cancelamento e refiz o cancelamento e nada de devolverem o meu dinheiro...muito chato isso. Até agora nem a mercadoria e nem o dinheiro.,3,2,3.79.0,2022-10-10 18:37:12,"Oi. Por segurança dos seus dados, eu não consigo olhar o pedido por aqui, tá? 😕 Mas, temos um time prontinho pra te atender! É só enviar os dados da compra através desse link 👉 ( https://maga.lu/atendimento ). Você pode copiar e colar, ou digitar ele no navegador. 😉 Magalu - Compras Online",2022-10-11 11:34:20,most_relevant,com.luizalabs.mlapp
f4493b13-39af-46ee-b5b0-51a498cce6bc,Aguinaldo Nascimento,https://play-lh.googleusercontent.com/a-/AD5-WCkgUyYKAuZthHoB6ALxInmWT4zUGQFFcRhnk5EB,"Ganharia 5 estrelas se tivesse um canal de fácil acesso para resolver os problemas,trocas,entregas ou qualquer outro problema relacionado a compra,o app até te dá opção de vc ligar no 0800 onde liguei e fiquei ouvindo música e propaganda s por mais de 20 minutos e acabei desistindo.",3,1,3.79.0,2022-10-12 02:55:16,"Oii, xxx. Lamentamos profundamente que essa tenha sido sua experiencia conosco. Vamos fazer de tudo para melhorar, agradeço o feedback. Magalu - Compras Online",2022-10-13 13:26:02,most_relevant,com.luizalabs.mlapp
c5c060dd-0bb3-4862-bf13-fdc6112bef8b,Renata Santos,https://play-lh.googleusercontent.com/a-/AD5-WCkJJ-UAjzIx-84n-mpNU7oSf_ActfjhU81_38CW,"Já comprei várias coisas pelo app magalu, nunca tive problema, porém essa última compra que fiz meu produto costa que já foi entregue, porém não recebi nenhum produto, estou muito desesperada e decepcionada, eles não faz nada por mim.",3,2,3.81.0,2022-10-31 14:50:23,"Oi, Renata. Sentimos muito por isso! Peço para que entre em contato com nosso time através deste link 👉(https://maga.lu/atendimento), é só copiar o mesmo e colar em seu navegador. Que lá eles vão te ajudar, ok?!",2022-10-31 15:38:25,most_relevant,com.luizalabs.mlapp
b4271c4b-5f52-4807-aa1e-a38a5e405ad7,Fernanda Teodoro,https://play-lh.googleusercontent.com/a-/AD5-WCnDoRClZzWmXLs-RCmG4QwdBht8Pd5Cy1v65IlX,"Gosto muito do aplicativo, mas tive problemas com duas mercadoria. Uma delas veio amassado e at hoje não resolveram meu problema. E hoje recebi uma mercadoria faltando peça .infelizmente estou perdendo a confiança",3,2,3.80.0,2022-11-02 02:58:45,"Oi, Fernanda. Por segurança dos seus dados, eu não consigo olhar o pedido por aqui, tá? 😕 Mas, temos um time prontinho pra te atender! É só enviar os dados da compra através desse link 👉 ( https://maga.lu/atendimento ). Você pode copiar e colar, ou digitar ele no navegador. 😉 Magalu - Compras Online",2022-11-03 13:13:32,most_relevant,com.luizalabs.mlapp
01e865ea-cb83-48a1-9181-ecba24eba35b,Edna Marcia,https://play-lh.googleusercontent.com/a-/AD5-WCl4HZgLM5kYPs44-fZJ3IOR9pkhqR4OEg4DDApdNw,"Foi rápido a forma de efetuar a compra...quero ver o produto e a entrega...depois comento aqui. Entrega rápida e produto barato, porém de baixa qualidade.",3,2,3.80.0,2022-10-28 18:48:35,"Oi, Edna. Sentimos muito por isso! Peço para que entre em contato com nosso time através deste link 👉(https://maga.lu/atendimento), é só copiar o mesmo e colar em seu navegador. Que lá eles vão te ajudar, ok?!",2022-10-30 17:04:23,most_relevant,com.luizalabs.mlapp
a4a91667-5b4e-405f-a536-e675f0f0408e,Roselane Ferreira,https://play-lh.googleusercontent.com/a/AEdFTp4N3Xy47yzxNnA_pH8hfMqG1wmEXFSN-iR-wDvb=mo,Sempre compro é rápido a entrega nunca tive problemas só o frete que as x empede da compras pois são muitas das x o dobro da mercadoria absurdo isso fico chateado porque entrega direitinho boms produtos preço bom MT oferta mas o frete chega da tristeza,3,4,3.79.0,2022-10-04 10:56:10,"Oi, Roselane. Sentimos muito por isso! Peço para que entre em contato com nosso time através deste link 👉(https://maga.lu/atendimento), é só copiar o mesmo e colar em seu navegador. Que lá eles vão te ajudar, ok?!",2022-10-04 11:51:47,most_relevant,com.luizalabs.mlapp
a8e27566-445d-4340-ba63-4da6ae270fa2,Lu Haas,https://play-lh.googleusercontent.com/a/AEdFTp7v7XGvhtIdJtiGD-hYpEMUyAyxyo-U7jOhPXYY=mo,A compra não tenho problemas mas as retiradas na loja são sempre com atraso. Isso faz com que muitas vezes tenho que comprar em outro lugar. Não confio no prazo de entrega.,3,1,3.81.0,2022-11-18 00:01:05,"Oi, Lu. Sentimos muito por isso! Peço para que entre em contato com nosso time através deste link 👉(https://maga.lu/atendimento), é só copiar o mesmo e colar em seu navegador. Que lá eles vão te ajudar, ok?!",2022-11-18 14:24:06,most_relevant,com.luizalabs.mlapp
e2487157-5d51-4559-8309-b6ba494969e2,Josi Nunes,https://play-lh.googleusercontent.com/a-/AD5-WCmrvN_K1wYcF33saMoBqkSsvnfDApXID237QQIYXQ,"Alguns produtos que estão esgotados, nem deveria está amostra, assim a gente não perde tempo tentando finalizar a compra. Alguns fretes estão altíssimo que nem compensa a compra",3,2,3.80.0,2022-10-24 17:21:38,"Oi, Josi. Sentimos muito por isso! Peço para que entre em contato com nosso time através deste link 👉(https://maga.lu/atendimento), é só copiar o mesmo e colar em seu navegador. Que lá eles vão te ajudar, ok?!",2022-10-25 11:44:34,most_relevant,com.luizalabs.mlapp
97610b11-c546-4ac0-9d6b-491e0d487015,Gê da Silva,https://play-lh.googleusercontent.com/a-/AD5-WCk3spbP46Svd6eSYZyZl1acLDnxu8JI9tETQt7u8g,"Acho pouco intuitivo a maneira como estão disposta as categorias... poderia aprender com o da Shein., por exemplo. mas atende a necessidade",3,2,3.79.0,2022-10-15 18:33:50,"Oi, Gê. Sentimos muito por isso! Peço para que entre em contato com nosso time através deste link 👉(https://maga.lu/atendimento), é só copiar o mesmo e colar em seu navegador. Que lá eles vão te ajudar, ok?!",2022-10-16 12:01:55,most_relevant,com.luizalabs.mlapp
3a918879-16de-4e69-8262-68458f7065c8,Hildo Luiz,https://play-lh.googleusercontent.com/a/AEdFTp58hLPihSMyUhpbTMPpf5Q_4_tS_H8oi_noKmon=mo,Sempre Faso compra pelo app nunca tive problema com lojas parceiras mas na última compra não me enviaram o produto Me externaram o dinheiro Mas perdi muito tempo pois era um produto de urgência pois tenho criança pequena e era época de frio Por isso 3 estrela caso contrário seria 5 Vendedores assim deveria ser excluído pois quem leva nome e o magazine Luiza,3,2,3.80.0,2022-10-24 00:46:21,"Oi, Hildo. Sentimos muito por isso! Peço para que entre em contato com nosso time através deste link 👉(https://maga.lu/atendimento), é só copiar o mesmo e colar em seu navegador. Que lá eles vão te ajudar, ok?!",2022-10-24 13:45:22,most_relevant,com.luizalabs.mlapp
c5a05ce2-fd30-4745-a8cb-c7e01e45dc34,Leigmar Aparecida,https://play-lh.googleusercontent.com/a/AEdFTp48JLt08G5shgRDZoyGHR2XuuU4rAiKcdXibItD=mo,Entro no aplicativo não estou conseguindo entrar nos meus pedidos e minha listas de favoritos está vazia. Quando vou fazer login cai para fazer cadastro ou criar conta coloco meu CPF nem tem como entrar...tá horrível!!,3,2,3.81.0,2022-11-12 15:57:44,"Oi, Leigmar. Sentimos muito por isso! Peço para que entre em contato com nosso time através deste link 👉(https://maga.lu/atendimento), é só copiar o mesmo e colar em seu navegador. Que lá eles vão te ajudar, ok?!",2022-11-12 16:06:40,most_relevant,com.luizalabs.mlapp
873d09d3-8166-471e-9da1-448931201ea2,Rita De Cassia,https://play-lh.googleusercontent.com/a-/AD5-WClVcJwwetT3ZhPa-mqbnqh7uUrljLb5IurvOWCE,"O app é bom mais só que a demora pra entregar os produtos é demais , já estou louca aqui e deveriam ter entregas mais por perto ,por ex em sete lagoas achei que iria receber logo ,mas minha mercadoria tá vindo lá de São Paulo afff muito longe e eu tão perto de lojas Magalu aqui🥴 vamos melhorar aí Magalu👍",3,2,3.80.0,2022-10-25 12:51:49,"Oi, Rita. Sentimos muito por isso! Peço para que entre em contato com nosso time através deste link 👉(https://maga.lu/atendimento), é só copiar o mesmo e colar em seu navegador. Que lá eles vão te ajudar, ok?!",2022-10-25 13:05:26,most_relevant,com.luizalabs.mlapp
67c007fb-3883-4dd1-b7fa-aaecb2fcb408,Maria Celia,https://play-lh.googleusercontent.com/a/AEdFTp7ex7YO1ScEzZI8AsXNo9iquJ97LpwtiZc1B2AQ=mo,Boa tarde a entrega foi rápido gostei mas não gostei do produto eu pedi foi um kit de três peças que põe acima da descarga do banheiro e veio só uma completamente diferente da que eu pedi,3,3,3.79.0,2022-10-07 17:53:18,"Oi, Maria. Sentimos muito por isso! Peço para que entre em contato com nosso time através deste link 👉(https://maga.lu/atendimento), é só copiar o mesmo e colar em seu navegador. Que lá eles vão te ajudar, ok?!",2022-10-10 11:39:40,most_relevant,com.luizalabs.mlapp
fed63876-2cb9-4276-8a83-40ed444b1310,Ana Fátima,https://play-lh.googleusercontent.com/a/AEdFTp7laNMR3fplxmRAhZ4MovhE8FCOOVaxCITjSmpv=mo,"Gostei sim muito de comprar com vcs ,só tive um problema na compra que fiz de uma escrivaninha que uma das madeiras veio com rachadura ,mais como eu não tive verificado na entrega não quis fazer a reclamação.",3,2,3.79.0,2022-10-19 17:38:32,"Oi, Ana. Sentimos muito por isso! Peço para que entre em contato com nosso time através deste link 👉(https://maga.lu/atendimento), é só copiar o mesmo e colar em seu navegador. Que lá eles vão te ajudar, ok?!",2022-10-20 13:43:20,most_relevant,com.luizalabs.mlapp
b70d6d73-a22d-4b9a-8b4b-62ccdd86c3c9,Vanieli Francelino da Silva,https://play-lh.googleusercontent.com/a-/AD5-WCntzqEhs_REkdPoBo5jpIqqTqcnucbAh4BWCmKQ,"Não consigo entrar no aplicativo, fica pedindo atualização mas não consigo e fica falando q é errado com minha internet mas minha internet está ótimo. Fiz uma compra e também não consigo ver.",3,2,3.79.0,2022-10-10 05:45:23,"Oi, Vanieli. Sentimos muito por isso! Peço para que entre em contato com nosso time através deste link 👉(https://maga.lu/atendimento), é só copiar o mesmo e colar em seu navegador. Que lá eles vão te ajudar, ok?!",2022-10-10 15:59:46,most_relevant,com.luizalabs.mlapp
8422f00a-d3af-49ce-802e-21fd90a6c3e8,Amanda Lopes,https://play-lh.googleusercontent.com/a-/AD5-WCmO73edaz6p1UxFAq4mcEhQ7ZmDyz-nf6d99oAHapQ,"O prazo de entrega foi ótimo. Porém o entregador não foi até a minha residência, mesmo eu informando tudo por telefone. O entregador ao invés de seguir as instruções e entregar em minha residência. O mesmo preferiu esperar que eu foser até ele, que estava esperando no carro dele, que estava a alguns metros de distância.",3,3,3.79.0,2022-10-01 20:40:23,"Oi, Amanda. Sentimos muito por isso! Peço para que entre em contato com nosso time através deste link 👉(https://maga.lu/atendimento), é só copiar o mesmo e colar em seu navegador. Que lá eles vão te ajudar, ok?!",2022-10-03 11:44:58,most_relevant,com.luizalabs.mlapp
6312c4b1-f8cd-4699-bab4-9b4ec0c579b3,Rafael Fraga,https://play-lh.googleusercontent.com/a-/AD5-WCnfDpzkN2kEy1gw_DSh7R0NuTQRP8i6IxIhNfO_,E bom porem os fretes em algumas compras sao bem pesados... poderiam dar descontos melhores nesse quesito fora isso o app e bom demais comprei muita coisa por ele e continuarei comprando!,3,2,3.79.0,2022-10-19 16:42:02,"Oi, Rafael. Sentimos muito por isso! Peço para que entre em contato com nosso time através deste link 👉(https://maga.lu/atendimento), é só copiar o mesmo e colar em seu navegador. Que lá eles vão te ajudar, ok?!",2022-10-20 13:35:58,most_relevant,com.luizalabs.mlapp
1c971277-d046-4490-af28-cb6078f87fea,Pretta Minny,https://play-lh.googleusercontent.com/a-/AD5-WCm7VU7TCc6NxnXLRhB4D1YGwtB9Hn05hpUrChQ9-g,"Olha pelo q reparei cobram uma taxa alta e nao cumprem o prazo estabelecido, de sete dias passou p 10 cm taxa de 119,00... E pelo q vi alem disso nao montam o produto. Toda loja de moveis montam e com taxa de entrega justa",3,3,3.79.0,2022-10-06 20:55:04,"Oi. Sentimos muito por isso! Peço para que entre em contato com nosso time através deste link 👉(https://maga.lu/atendimento), é só copiar o mesmo e colar em seu navegador. Que lá eles vão te ajudar, ok?!",2022-10-07 15:09:50,most_relevant,com.luizalabs.mlapp
98430ce5-38a0-4df7-9986-9e41a7eff900,Gabriela,https://play-lh.googleusercontent.com/a/AEdFTp6mFgg35dh9R-8ZWfJv45yv5j1IWUaIAEsiU5X9rA=mo,"Aplicativo com bug e demoras, o meu primeiro pedido já deu errado, endereço estava errado e antes de pedir eu corrigi, mas não deu certo e o endereço permaneceu errado no pedido.",3,0,3.81.0,2022-11-25 14:06:53,"Oi, Gabriela. Sentimos muito por isso! Peço para que entre em contato com nosso time através deste link 👉(https://maga.lu/atendimento), é só copiar o mesmo e colar em seu navegador. Que lá eles vão te ajudar, ok?!",2022-11-25 15:19:01,most_relevant,com.luizalabs.mlapp
16f87287-d60c-407a-9767-4a4c701f66d2,deby veneziano,https://play-lh.googleusercontent.com/a-/AD5-WCnqirC_KmAEADo7tOs52vTNcSukxrKSBhGIw75Cpw,"Recebi todas as compras que Efetuei no Aplicativo, com atraso. Nenhuma foi entre na data prevista. Fora um Rack que comprei e nao subiram no elevador deixaram na portaria. O Aplicativo nao atualiza o rastreio, e envia muita mensagem de promoção. Continuo comprando porque tem parceiros que ainda estou avaliando.",3,13,3.78.0,2022-09-22 21:12:54,"Oi, deby. Sentimos muito por isso! Peço para que entre em contato com nosso time através deste link 👉(https://maga.lu/atendimento), é só copiar o mesmo e colar em seu navegador. Que lá eles vão te ajudar, ok?!",2022-09-26 11:44:43,most_relevant,com.luizalabs.mlapp
890b8456-d961-49c2-9d43-9c41326319e1,Gabriel Pereira,https://play-lh.googleusercontent.com/a-/AD5-WCmeIK3U5eLRFAFV_-u7eZYlDn6xzKvULANWrZCh,"Bom, mas meu cartão diz que a compra foi aprovada e o App ainda não confirmou, tento entrar em contato com a central mas a ligação sempre cai.",3,0,3.81.0,2022-12-08 10:11:28,"Oi, Gabriel. Sentimos muito por isso! Peço para que entre em contato com nosso time através deste link 👉(https://maga.lu/atendimento), é só copiar o mesmo e colar em seu navegador. Que lá eles vão te ajudar, ok?!",2022-12-08 11:35:22,most_relevant,com.luizalabs.mlapp
07e507ff-d2c6-4dc7-aa29-9147ac2f6833,Leonardo Alves,https://play-lh.googleusercontent.com/a-/AD5-WCmHwMCVokY1912ltKknriD2hoK51VyGdBfeowxFATI,bom dia não crítico os mais sim o tempo de entrega dos produtos. Ao um tempo atrás fiquei impressionado com a agilidade de entrega. peço desculpas por ter sido tão sincero mas é o que eu acho blz,3,2,3.79.0,2022-10-13 13:29:38,"Oi, Leonardo. Sentimos muito por isso! Peço para que entre em contato com nosso time através deste link 👉(https://maga.lu/atendimento), é só copiar o mesmo e colar em seu navegador. Que lá eles vão te ajudar, ok?!",2022-10-13 14:55:10,most_relevant,com.luizalabs.mlapp
6c52b24f-fd93-4891-ad32-787ea1814659,Doze Dozauto,https://play-lh.googleusercontent.com/a-/AD5-WCmLQcbNeAIHEUTOAobDMQQDUWUDnaYebpnVKULXoA,"Muita mensagem queria saber como desativar de outra maneira, pois em configurações já é nativo a desativação. Chega mensagem toda hora.",3,2,3.80.0,2022-10-31 14:37:16,"Oi, Doze. Sentimos muito por isso! Peço para que entre em contato com nosso time através deste link 👉(https://maga.lu/atendimento), é só copiar o mesmo e colar em seu navegador. Que lá eles vão te ajudar, ok?!",2022-10-31 15:37:58,most_relevant,com.luizalabs.mlapp
fb1a85dc-0bb7-4057-8588-8e3920d14a6a,Beatriz Albuquerque,https://play-lh.googleusercontent.com/a-/AD5-WCneBWH9AmhNqNJkT_4vPT4cMIe8bc_1uqQlRmVwC1A,Não gostei que o app indica o desconto pelo magalupay mas na hora de finalizar a compra diz que o produto não está disponível para aquela forma de pagamento.,3,0,3.81.0,2022-11-27 17:04:03,"Oi, Beatriz. Sentimos muito por isso! Peço para que entre em contato com nosso time através deste link 👉(https://maga.lu/atendimento), é só copiar o mesmo e colar em seu navegador. Que lá eles vão te ajudar, ok?!",2022-11-29 14:49:23,most_relevant,com.luizalabs.mlapp
10f0c18a-b4b5-4133-bf5f-a68b85fcd36f,Rejane Dark,https://play-lh.googleusercontent.com/a-/AD5-WCmmTS8c26472_fahu1lT1oO2E2Jz3ISkE7Ydg-dnN8,"Não consigo mais entrar na minha conta, já redefini a senha várias vezes, desinstalei o app e não consegui. O email chegam mais o acesso não vai.",3,1,3.81.0,2022-12-12 12:08:22,"Oi, Rejane. Sentimos muito por isso! Peço para que entre em contato com nosso time através deste link 👉(https://maga.lu/atendimento), é só copiar o mesmo e colar em seu navegador. Que lá eles vão te ajudar, ok?!",2022-12-12 19:18:02,most_relevant,com.luizalabs.mlapp
e177b8a7-fa2d-4eb5-b97a-028a8a89b0a9,Rosangela Aparecida Souza,https://play-lh.googleusercontent.com/a/AEdFTp5A8dfonVTrl5fWJObF3qUw4Khsw2FksbtEB5Ac=mo,"Acho que o app deveria ser um pouco mais rígido quando alguém abrir uma conta e criar a sua loja on-line, pq comprei um ar-condicionado de um site que encontrei no app do Magalu e levei um golpe grande de um siti que faz parceria com o Magalu ( amarinho cruz)",3,0,3.81.0,2022-12-03 01:42:17,"Oi, Rosangela. Sentimos muito por isso! Peço para que entre em contato com nosso time através deste link 👉(https://maga.lu/atendimento), é só copiar o mesmo e colar em seu navegador. Que lá eles vão te ajudar, ok?!",2022-12-06 15:08:04,most_relevant,com.luizalabs.mlapp
638fb7af-c52f-486d-9070-e56d61146d09,Maria do Carmo amorim de Souza,https://play-lh.googleusercontent.com/a/AEdFTp5GCcw67YbUomNrf9Zqj0RAJltMR3KRKdfMCBVT=mo,"Com loja paceira é sem comunicação comprei queria trocar, mas pra resolver deixa você no vácuo, não dá retorno nenhum, manda vc falar com vendor,ele manda pra app fica difícil.",3,0,3.81.0,2022-12-09 22:22:02,"Oi, Maria. Sentimos muito por isso! Peço para que entre em contato com nosso time através deste link 👉(https://maga.lu/atendimento), é só copiar o mesmo e colar em seu navegador. Que lá eles vão te ajudar, ok?!",2022-12-11 11:21:46,most_relevant,com.luizalabs.mlapp
07cd0417-4996-4fa6-8a70-baa0599161ea,Raílyson Laurindo,https://play-lh.googleusercontent.com/a-/AD5-WCmmHFuY44Q5b5RPhBwJtnSt8XIFcGcqCrrbgg9b,"Não consigo entrar na minha conta, já troquei de senha, desinstalei e instalei e não entra na conta, mostra ""ocorreu um erro inesperado""!",3,0,3.81.0,2022-11-29 01:54:55,"Oi, Raílyson. Sentimos muito por isso! Peço para que entre em contato com nosso time através deste link 👉(https://maga.lu/atendimento), é só copiar o mesmo e colar em seu navegador. Que lá eles vão te ajudar, ok?!",2022-11-29 16:51:59,most_relevant,com.luizalabs.mlapp
9b05b310-6622-4e46-8de1-e0fa1d8c2de8,Ilusca Maiara Almeida Garcia,https://play-lh.googleusercontent.com/a-/AD5-WCkhaaBm46JzV8NhZZ5PoGtCCOmNPe67xLYhL0bMUnA,"Olá bom dia, tudo bem? Comprei muitos produtos pelo o site, super bom, mas de um tempo para cá está incansável fazemos a compra depois manda que não houve comunicação com e está em falta o produto. Da outra vez foi pago pelo cartão agora é no mínimo 30 dias para o estorno e agora no pix já tinha que ser devolvido no mesmo instante que cancelou a compra, milionária não sou para ficar aguardando a boa vontade de vocês para fazer o estorno. Isso tudo ocorreu era 3:10 da manhã faça por completo.",3,12,3.78.0,2022-09-26 11:00:52,"Oi, Ilusca. Sentimos muito por isso! Peço para que entre em contato com nosso time através deste link 👉(https://maga.lu/atendimento), é só copiar o mesmo e colar em seu navegador. Que lá eles vão te ajudar, ok?!",2022-09-26 13:30:56,most_relevant,com.luizalabs.mlapp
