reviewId,userName,userImage,content,score,thumbsUpCount,reviewCreatedVersion,at,replyContent,repliedAt,sortOrder,appId
cbaa293b-f84c-488d-b971-f9ab60d2a8de,Fabio Araujo,https://play-lh.googleusercontent.com/a/AEdFTp5zCrDp7eGEP4YcSGU3u_cnx0F0hZS9_cx-aXWG=mo,"Muito bom o aplicativo, ajuda muito a fazer compras. Agora poderia tirar a cobrança do frete, porque como a gente é consumidor, deveria não pagar frete. Já estamos pagando o produto, pagando impostos, e ainda ter que pagar frete, isso é errado!!!",4,3,3.79.0,2022-10-10 02:42:55,"Olá, Fabio. Fico muito feliz que vc esteja gostando do nosso SuperApp. 🥳 Fazemos questão de continuar trabalhando pra proporcionar a melhor experiência de compra a todos vcs. Obrigada pelo comentário, ele é muito importante para nós do Magalu! 💙 - Magalu - Compras Online",2022-10-10 16:01:21,most_relevant,com.luizalabs.mlapp
b4daf518-e7b3-4581-8fb8-e14d2248d075,Thiago Mazzoneti,https://play-lh.googleusercontent.com/a-/AD5-WCnj2tF6-BtmXPpCQ7LOUIRwOrQIJjIenxjXP1DFSQ,"Eita app top! Uma pena ter mudado a aba de compra junto mudou pra varias opções, antes era mais simples sendo que era apenas uma e voce via todos os produtos aprnas rolando a tela. Volta! Depois da parte de cima do comentário retiraram a função...",4,9,3.81.0,2022-11-18 19:40:10,"Olá, Thiago. Fico muito feliz que vc esteja gostando do nosso SuperApp. 🥳 Fazemos questão de continuar trabalhando pra proporcionar a melhor experiência de compra a todos vcs. Obrigada pelo comentário, ele é muito importante para nós do Magalu! 💙 - Magalu - Compras Online",2022-11-16 12:59:35,most_relevant,com.luizalabs.mlapp
fd798d82-70c5-4b1b-9120-77ae171e63ae,Suyane Lanuccy,https://play-lh.googleusercontent.com/a/AEdFTp5PJJ4Av1jk3d8mX4cvV3ybA4vFkQVoTJo-quUi=mo,"O app é muito bom, muito dinâmico e objetivo, eu uso sempre. Só seria interessante que o cliente pudesse avaliar as coisas que compram no caso de receberem os produtos com defeito. Se tem essa opção eu não encontrei.",4,21,3.81.0,2022-10-31 23:41:35,"Oi, Suyane. Já deixei anotado aqui, tá? 📝 Tenho certeza que o setor responsável vai analisar o seu feedback com muito carinho. Desde já te agradeço por contribuir com o nosso crescimento. 🥰 Magalu - Compras Online",2022-11-01 14:14:53,most_relevant,com.luizalabs.mlapp
2872c0e4-525a-4605-9b74-a1294b1835a9,Daniel Rebello,https://play-lh.googleusercontent.com/a-/AD5-WCnvSStOF8OMvfQTi_hKIozDWj5uzZ2V3BbUBht54Q,"Comprei um HD externo a vista via boleto, levou 10 dias para a nota ser emitida e já se passou mais de um mês e o produto não saiu da loja para entrega. O produto não chegou e apesar de ter levado 3 meses a Magazine Luiza reembolsou o valor. Depois dei novas chances a empresa e todas as compras foram ok.",4,7,3.79.0,2022-10-05 04:03:07,"Ola, Daniel. Que bom que gostou do seu produto novo. 🥳 Amei saber disso, viu? 💙 Magalu - Compras Online",2022-10-05 11:32:47,most_relevant,com.luizalabs.mlapp
aaa678e8-877e-4769-a0f3-13df8d538d06,Leonardo Santos,https://play-lh.googleusercontent.com/a-/AD5-WClU6Yv9rzGN4NC76kNzd-O7ZuZfuT_BWrlkzWwWFqw,"O App tem uma interface boa, mas ainda apresenta uns travões e bugs no uso. No geral, a qualidade é boa. São problemas que apps como Aliexpress e Shopee TB apresentam.",4,0,3.81.0,2022-12-03 05:39:51,"Oi, Leonardo. Sentimos muito por isso! Peço para que entre em contato com nosso time através deste link 👉(https://maga.lu/atendimento), é só copiar o mesmo e colar em seu navegador. Que lá eles vão te ajudar, ok?!",2022-12-09 15:02:57,most_relevant,com.luizalabs.mlapp
141e3e06-6d3c-4e87-a73f-2f1592ec7895,Márcio Bortoli,https://play-lh.googleusercontent.com/a-/AD5-WClKT9eB7z9xbrWlhIV-_cT8wcGXxWn6BB2X9PfikA,"Funciona bem , mas a busca e os filtros são limitados o que dificulta a escolha dos produtos. Mas gosto muito da magalu principalmente das ofertas em 30x sem juros que possibilita adquirir produtos mais caros e melhores pra nossos lares",4,1,3.81.0,2022-11-28 14:50:10,"Oi, Márcio. Que notícia boa! 😍 Fico muito feliz por isso, viu?! Sua satisfação é muuuuito importante. E já sabe, né? Se precisar é só me chamar! 😉 Magalu - Compras Online
",2022-11-30 15:37:11,most_relevant,com.luizalabs.mlapp
d9820d9c-2382-4704-b833-b80482523437,Jakson Gomes,https://play-lh.googleusercontent.com/a-/AD5-WClmiz7G2VJj224gHMd0RFYmw52d888n62UKNWu2HVo,"Sobre agilidade de entrega do último pedido que fiz foi bem rápido, antes do prazo determinado. Gostei espero que continue assim com todas as entregas. 4 estrelas por conta de alguns valores de entregas que considero desnecessário.",4,2,3.79.0,2022-10-19 00:54:51,"Oi, Jakson. Entrega rápida é com a gente mesmo em 😉! Muito bom saber q gostou, agora já ativa as notificações do nosso super app, para vc não perder as promoções q estão rolando por lá. Magalu - Compras Online💙📱",2022-10-20 15:43:32,most_relevant,com.luizalabs.mlapp
81970dc8-26a3-4324-83fa-224f60acb3db,Tamires Monica,https://play-lh.googleusercontent.com/a/AEdFTp7ATUTS551nGXiI-jxP6bFQbVM70bfG0NJ8mygH=mo,"Entregou muito, muito antes do prazo. Eu estava espero pro início do mês que vem! Foi ótimo aos entregadores agradeço tbm, pois no sistema entrou o endereço do meu trabalho, onde eu teria que pagar outro frete local para entregar na minha casa, e eu expliquei a situação e o pessoal da entrega deixaram na minha porta, Excelente! Ainda não abri o produto para a montagem espero está tudo certinho.",4,4,3.79.0,2022-10-06 10:01:15,"Olá, Tamires. A entrega mais rápida do Brasil é assim mesmo #PiscouChegou. 😉 Não deixe de aproveitar as nossas ofertas e promoções no SuperApp Magalu, hein?! 💙📱 - Magalu - Compras Online",2022-10-06 10:42:48,most_relevant,com.luizalabs.mlapp
fda74c64-e8e4-4437-81a4-208811b0d976,Rodolfo Guilherme,https://play-lh.googleusercontent.com/a-/AD5-WClCWUDPY1xRFv2TVcOZMAkaNztcVxMRyoshvf6Q-bU,"O app é ótimo mas tem um único detalhe q faz muita diferença pra mim. Antes de comprar qualquer item, sempre vejo as avaliações de outros clientes q já compraram antes, em apps de outras lojas, como das Casas Bahia, é possível q os clientes além e comentarem postem fotos reais do produto na casa deles, e por muitas vezes o produto é ainda mais bonito do que a imagem ilustrativa do anúncio, o que nos leva a decidir por comprar. Então como dica eu peço que vocês permitam fotos na hr de avaliar.",4,10,3.80.0,2022-10-23 16:31:53,"Oiee! Pode deixar vou anotar a sua sugestão e encaminhar ao setor responsável para que possamos analisar. Muito obrigada pela parceria, conte sempre com nosso time!Magalu - Compras Online💙",2022-10-23 17:16:31,most_relevant,com.luizalabs.mlapp
ba0f4e9e-b1b0-479f-90c1-e5c513c28c8c,Everton Regis,https://play-lh.googleusercontent.com/a-/AD5-WCn3ymHNRHeKHWuGKfeWhFrDadUbapWiw4rJbV93ZA,"Excelente loja no quesito variedades, preços, segurança e confiabilidade, porém não sei o que está acontecendo ultimamente não está sendo possível comprar mais, foi necessário 5 tentativas para comprar 2 produtos, muitos cancelamentos por parte dos fornecedores!!! A gente compra, paga, espera 1 semana para ser informado que a compra foi cancelada, Magalu precisa ver isso urgente, se não quer vender não oferece.",4,6,3.81.0,2022-11-14 20:56:30,"Olá, Everton. Fico muito feliz em saber disso, agradeço em nome de toda a Equipe Magalu. 💙 A sua experiência é muito importante para nós e esse tipo de comentário nos ajuda a melhorar cada vez mais. 🥰 - Magalu - Compras Online",2022-11-16 11:41:52,most_relevant,com.luizalabs.mlapp
d4fd7dc2-51ee-490f-82f4-100532f9e596,Luciana Bernardes,https://play-lh.googleusercontent.com/a/AEdFTp7let_GQ-QHtzfWnT-CLNIflI6PQ4X_QrUqq4u1=mo,Compras pelo app até hj foi perfeito. Entrega certinho até antes do prazo. Já na loja física tive uma péssima experiência de ir comprar e a oferta que estava no panfleto simplesmente não existe na loja. Perdi tempo e dinheiro de ir até o local.,4,4,3.81.0,2022-11-13 01:02:06,"Olá, Luciana. É muito legal saber que vc tenha tirado um minutinho do seu tempo pra elogiar o SuperApp Magalu. 💙 Seu comentário é muito importante pro nosso desenvolvimento. E já sabe né? Se precisar, pode contar com a gente! 🤩 - Compras Online",2022-11-14 12:26:25,most_relevant,com.luizalabs.mlapp
7322afa6-68d7-4a56-8ebf-b6b99fb031e1,Cristina Maria,https://play-lh.googleusercontent.com/a/AEdFTp4a6BaHTU8oVqx5AnGL8OARfrsms7Fq6niulCqG=mo,"Boa tarde gostei, chegou antes do prazo previsto, porém quero uma explicação: Junto com a compra do telefone eu também comprei um outro produto que é um cachepôs para colocar plantas inclusive o pedido foi cobrado junto na mesma nota e desde então nunca foi mencionado o mesmo só se falou na compra do telefone eu logo que percebi que não era mencionado o outro produto pararam de me informar qualquer coisa. Então Estou no aguardo dessa outra compra.",4,3,3.79.0,2022-10-14 17:11:38,"Oi Cristina. Peço para que entre em contato com nosso time através deste link 👉(https://maga.lu/atendimento), é só copiar o mesmo e colar em seu navegador. Que lá eles vão te ajudar, ok? 💙 - Magalu - Compras Online",2022-10-14 18:00:22,most_relevant,com.luizalabs.mlapp
b5478fae-1cc1-43fa-a40d-b4cd01b515dc,Marcia Castro,https://play-lh.googleusercontent.com/a-/AD5-WCn8JIrslvGSt655caSTo_T9--WrLttU-jTBILvRQg8,"Como sempre a compra foi ótima, a entrega foi super rápida, porém a embalagem de fábrica foi BASTANTE DANIFICADA no transporte. Isso me deixou muito insatisfeita, pois trata-se de um PRESENTE! Sugiro que a LOJA EMBALE o produto, como é feito por outras empresas, preservando a embalagem de fábrica do produto. Repito: estou BEM INSATISFEITA COM O OCORRIDO a ponto de decidir NÃO comprar mais nesta loja, quando o produto for para PRESENTE.",4,0,3.81.0,2022-12-08 12:37:23,"Oi, Marcia. Sentimos muito por isso! Peço para que entre em contato com nosso time através deste link 👉(https://maga.lu/atendimento), é só copiar o mesmo e colar em seu navegador. Que lá eles vão te ajudar, ok?!",2022-12-20 12:45:45,most_relevant,com.luizalabs.mlapp
29646ca8-c860-4ab8-925f-167597cfcbd8,Kelly Kelly,https://play-lh.googleusercontent.com/a/AEdFTp4YpsebCKd0jR88KLhftk-pMoNIk_vXCwRfURbh=mo,"App muito bom!!! A gente consegue, resolver tudo por ele! Só acho, que deveria ter a opção de afiliado no mesmo aplicativo (com a opção de comprador e quando quiser mudar para a opção parceiro), seria excelente! Na torcida aqui, para aderirem essa ideia!!!!!",4,10,3.81.0,2022-11-03 12:51:21,"Oiee, Kelly! Pode deixar vou anotar a sua sugestão e encaminhar ao setor responsável para que possamos analisar. Muito obrigada pela parceria, conte sempre com nosso time!Magalu - Compras Online💙",2022-11-03 14:04:48,most_relevant,com.luizalabs.mlapp
43f2f4fd-d1fc-4295-9e72-0a509abb5fb6,Leide Maria santos,https://play-lh.googleusercontent.com/a/AEdFTp7-jOAV9PgTIyC0BgAmGMbVCDSq6J9oLYeXG4cA=mo,"Bom dia ,já faz algum tempo que compro por este app é sempre sou bem atendida .Mais a minha última compra foi um iPhone 11 que enviei de presente para minha neta, e qual foi minha surpresa:chegou uma pedra pelo valor de 38000 reais espero que até pelo meu currículo de criente ouro esta desagradável situação seja resolvida sem danos para mim.No mais todas as outra coisas chegaram no tempo.obrigada pelo espaço. Atenciosamente. LeideMaria.",4,3,3.81.0,2022-11-04 09:53:56,"Oi, Leide. Sentimos muito por isso! Peço para que entre em contato com nosso time através deste link 👉(https://maga.lu/atendimento), é só copiar o mesmo e colar em seu navegador. Que lá eles vão te ajudar, ok?!",2022-11-04 13:05:14,most_relevant,com.luizalabs.mlapp
3584a4a4-8c11-4704-bfd3-1560244558aa,Silvania Menezes,https://play-lh.googleusercontent.com/a/AEdFTp7IE97CMF9EjN7wlojtPQVxn5g7hFO4NrjD14ur=mo,"Gosto bastante de fazer compra pelo app,a única vez que não gostei foi na hora da entrega um pessoal que trabalha sem vontade joga o produto lá ,sem um sorriso no rosto para demonstrar o prazer da entra do produto ao cliente. OBS. Não foi nessa compra que recebi hoje, que aconteceu, foi em outra.",4,0,3.81.0,2022-11-29 14:23:56,"Oi Silvania . Sentimos muito por isso! Peço para que entre em contato com nosso time através deste link 👉(https://maga.lu/atendimento), é só copiar o mesmo e colar em seu navegador. Que lá eles vão te ajudar, ok? 💙 - Magalu - Compras Online",2022-12-01 12:31:17,most_relevant,com.luizalabs.mlapp
a1f90974-216c-4cc8-a729-7d011e1ef461,Biatriz Ferreira,https://play-lh.googleusercontent.com/a-/AD5-WCnQnFcOToV9gjHSlRtPabXxnOd6lrK-X-C_tAn9xQA,"O app é meio confuso e lento. Só fiz 1 compra nele e deu tudo certo, não tive problemas. Quanto ao frete, é muito rápido, comprei a noite e no outro dia pela manhã já foi entregue.",4,0,3.81.0,2022-11-25 22:21:44,"Olá, Biatriz. Fico muito feliz que vc esteja gostando do nosso SuperApp. 🥳 Fazemos questão de continuar trabalhando pra proporcionar a melhor experiência de compra a todos vcs. Obrigada pelo comentário, ele é muito importante para nós do Magalu! 💙 - Magalu - Compras Online",2022-11-28 12:44:41,most_relevant,com.luizalabs.mlapp
dde7732f-50c1-421e-8e9a-44c72886f5a2,Debora Sirino,https://play-lh.googleusercontent.com/a-/AD5-WCmFzsGzvVgo8uOz7LWH4L29xZzYhKGtQD8e5VO-Ghs,"Já realizei outras compras e ,como sempre , a entrega foi surpreendente : muito rápida , pisquei,chegou ,kkkk. O produto veio em ótimas condições ,muito bem embalado . Amei o jogo de panelas ,lindas e os utensílios também ,parecem ser de ótima qualidade ,o que não posso assegurar ,pois acabei de receber ,mas creio que irá atender as minhas expectativas.",4,3,3.81.0,2022-11-17 16:52:57,"Oi, Debora. Que notícia boa! 😍 Fico muito feliz por isso, viu?! Sua satisfação é muuuuito importante. E já sabe, né? Se precisar é só me chamar! 😉 Magalu - Compras Online",2022-11-18 11:24:33,most_relevant,com.luizalabs.mlapp
7a928e34-1e66-4ca3-bfdf-d9581ba61da9,Katia Silva,https://play-lh.googleusercontent.com/a/AEdFTp5L8XC8SceKNhapPuBP-npa-XofI31r1l1VHIQ1=mo,"O app do magalu é ótimo não tenho o que reclamar, só deixou a desejar o produto que comprei por último, recebi a fritadeira elétrica da marca Midia e a caixa veio molhada e mofada por sorte a fritadeira vem em volta um isopor que protegeu da umidade da cx, limpei o produto como informa no manual e fiz o teste, tirando a embalagem molhada e mofada o produto funciona perfeitamente.",4,1,3.80.0,2022-10-20 18:27:02,"Oi, Katia. Sentimos muito por isso! Peço para que entre em contato com nosso time através deste link 👉(https://maga.lu/atendimento), é só copiar o mesmo e colar em seu navegador. Que lá eles vão te ajudar, ok?!",2022-10-21 15:34:59,most_relevant,com.luizalabs.mlapp
3b388734-fc3f-468a-81e9-f918009b6f51,Andre Resende,https://play-lh.googleusercontent.com/a/AEdFTp5alAHAZKII9wL5tmFbdd6iGcOpk9hdg61l2l3y=mo,"Não tenho o que me queixar do aplicativo. Funciona perfeitamente. Oferece atendimento ao cliente, mas não funciona. O 0800 ninguém atende, o e-mail pede um tanto de especificação, que você desiste. Os pedidos chegam na maioria das vezes antes do prazo, mas se você já não conhece a mercadoria a chance é muito grande de você se decepcionar. A cobrança também é ágil e me parece seguro. O atendimento em geral tem muito o que melhorar.",4,5,3.81.0,2022-11-16 15:37:24,"Oi, Andre. Sentimos muito por isso! Peço para que entre em contato com nosso time através deste link 👉(https://maga.lu/atendimento), é só copiar o mesmo e colar em seu navegador. Que lá eles vão te ajudar, ok?!",2022-11-16 15:50:44,most_relevant,com.luizalabs.mlapp
e0f0730b-79d5-410a-9167-fc31a66bc627,joselice fatima da silva soriano,https://play-lh.googleusercontent.com/a/AEdFTp4k5gfEPLg3lr8O0O-S8TyfxqeJScDwqsxLj7Jl=mo,"Bom dia! Os produtos são bons preço bom , já comprei várias vezes, porém as entregas estão péssimas, os entregadores não entram com os produtos,moro em apartamento, não sobe,mesmo sendo produtos pesados como máquina de lavar, querem deixar no portão, comprei um Cooktop,deixei minha mãe para receber, ela teve que chamar a vizinha para pegar, pois o rapaz não subiu e ela não consegue desce. Peço que avalie este serviço. Grata!",4,3,3.81.0,2022-11-18 13:47:13,"Oi, joselice. Sentimos muito por isso! Peço para que entre em contato com nosso time através deste link 👉(https://maga.lu/atendimento), é só copiar o mesmo e colar em seu navegador. Que lá eles vão te ajudar, ok?!",2022-11-19 13:40:23,most_relevant,com.luizalabs.mlapp
f33762f0-fbee-479d-877d-b048b4a64f77,Samuel Ferreira Correa,https://play-lh.googleusercontent.com/a/AEdFTp4wtUFYPCvni_UYhGr72e960602Y22X-N5CsVas=mo,"As compras feitas que sao vendidas diretamente pelo magalu são ótimas, pois caso apresente qualquer problema a resolução é mais prática. Quando é apenas intermediadora, ou seja, vendida por outra loja se apresentar problema tem mais burocracias para e o produto nunca chega acompanhado da nota, vc necessita ir ao site puxar.",4,1,3.80.0,2022-10-20 22:22:51,"Oi, Samuel. Sentimos muito por isso! Peço para que entre em contato com nosso time através deste link 👉(https://maga.lu/atendimento), é só copiar o mesmo e colar em seu navegador. Que lá eles vão te ajudar, ok?!",2022-10-23 11:17:57,most_relevant,com.luizalabs.mlapp
6d002536-ed28-4440-ba25-0e0ef5f9fc8c,Clarissa Santos,https://play-lh.googleusercontent.com/a/AEdFTp47KE6YT6hf7IBf3Sd5f6wya119wzZ7xmhLjurq=mo,"Já realizei diversas compras no site. Algumas com seu prós outras com seus contras. Algumas cobram a taxa de frete MT alta, outras insinuam que chegarão na residente e vai pros correios. Gosto muito da opção de retirada em loja, super seguro e garante a entrega. Ademais... Os produtos sem defeito algum. Super indico 😉",4,7,3.81.0,2022-11-04 20:11:37,"Oi, Clarissa. Que notícia boa! 😍 Fico muito feliz por isso, viu?! Sua satisfação é muuuuito importante. E já sabe, né? Se precisar é só me chamar! 😉 Magalu - Compras Online",2022-11-07 12:18:31,most_relevant,com.luizalabs.mlapp
f8787d5d-0249-4833-a05b-a6570a5d52b9,Yanez Manoela,https://play-lh.googleusercontent.com/a-/AD5-WCmh5xbcJ1hjO0sNa0NcCeSUgTtG9aX8n8YCgDwPFQ,"Gosto do app, tem bons preços. Só precisa melhorar na parte de rastreio da encomenda... é difícil carregar e não é muito prático, além de não atualizar com frequência onde está o produto.",4,1,3.79.0,2022-10-14 11:11:33,"Oi, Yanez. Sentimos muito por isso! Peço para que entre em contato com nosso time através deste link 👉(https://maga.lu/atendimento), é só copiar o mesmo e colar em seu navegador. Que lá eles vão te ajudar, ok?!",2022-10-14 11:58:04,most_relevant,com.luizalabs.mlapp
8ac1a1ab-c499-4b3e-aceb-d57f4228b334,José Oetes NP,https://play-lh.googleusercontent.com/a/AEdFTp4RFyA20TvZoayC_LcQvijS8ZEZFc8c581eb2e3=mo,Atualizando: 1 ano depois corrigiram. (Ja reclamei disso a um ano e continua do mesmo jeito. No site vc consegue consultar as formas de pagamento na pagina do produto e como fica as parcelas nos cartões de credito comum e no próprio cartao da magazine luiza. Pelo app a unica forma é colocar o produto no carinho preencher os dados do cartão ai vc digita as parcelas e vê em quantas vezes está disponivel.... no site 1 clique a pagina desce e mostra pra vc...),4,4,3.81.0,2022-11-12 15:46:42,"Oi, José. Sentimos muito por isso! Peço para que entre em contato com nosso time através deste link 👉(https://maga.lu/atendimento), é só copiar o mesmo e colar em seu navegador. Que lá eles vão te ajudar, ok?!",2022-11-12 15:56:39,most_relevant,com.luizalabs.mlapp
d8f45b1e-54fa-46d6-889e-795c6fb19c7b,André Luiz,https://play-lh.googleusercontent.com/a-/AD5-WCmNM8d4ilUQ8GiuHo5jKYalu9QJHY1LReURCCd6Ng,Um ótimo app para controle de compras e operações nesta empresa. As informações ficam bem claras sobre os procedimentos. Controla bem as compras. O suporte para resolução de problemas foi eficiente via e-mail. Nisso o app não achei bom. Mas recomendo.,4,1,3.79.0,2022-10-16 04:53:14,"Olá, André. É muito legal saber que vc tenha tirado um minutinho do seu tempo pra avaliar o SuperApp Magalu. 💙 Seu comentário é muito importante pro nosso desenvolvimento. E já sabe né? Se precisar, pode contar com a gente! 🤩 - Compras Online",2022-10-17 11:04:08,most_relevant,com.luizalabs.mlapp
d3ecd76c-c56b-46d1-83be-40e8a35cda34,Anderson Gonçalves,https://play-lh.googleusercontent.com/a-/AD5-WCktNvYJQvtV3zl8UdITsjBp_IwI-UY7521XzAKh,Muito bom. Quase perfeito. Só não gostei muito do frete. Queria um sofá. Mas o frete é quase o mesmo valor do produto. Aí é desanimador. Muitos produtos desistimos de comprar o frete é muito caro,4,1,3.79.0,2022-10-18 19:34:02,"Oi, Anderson. O valor e o tempo do frete dependem de onde o produto vai sair, tá? O Magalu têm depósitos em diversos Estados do Brasil. O frete costuma aumentar quando o produto vai sair de um depósito que não fica localizado no seu Estado. Ah, alguns produtos são vendidos e entregues por nossos parceiros. 😉 Magalu - Compras Online",2022-10-19 18:08:33,most_relevant,com.luizalabs.mlapp
2fe2928b-6abf-4976-80d0-50f7667712c0,Maria Aparecida Lima,https://play-lh.googleusercontent.com/a-/AD5-WClDs_l_EqcBjKeOq8o5HgN7w9Z6ayUEOqEYY4d-EX8,"Todas as compras que realizei chegaram rápido e bem embalado,mas dessa última que recebi ontem,veio a embalagem toda adulterada,a caixa rasgada inclusive colocaram fita durex,enfim foi uma decepção,ainda bem que o produto está funcionando,mas fiquei insegura pelo estado que recebi o mesmo.",4,0,3.81.0,2022-12-06 13:31:18,"Oi, Maria. Sentimos muito por isso! Peço para que entre em contato com nosso time através deste link 👉(https://maga.lu/atendimento), é só copiar o mesmo e colar em seu navegador. Que lá eles vão te ajudar, ok?!",2022-12-13 15:38:22,most_relevant,com.luizalabs.mlapp
6fd02963-3efe-4d56-8ae5-1145e18b645a,Júlio César Giatti,https://play-lh.googleusercontent.com/a-/AD5-WCncINFPJGjEUZX25fat30nG1B1xIPUyGwZ9YPUjwg,"Chegou muito rápido, recomendo. OBS: só dei 04 estrelas pq, por se tratar de alimento (ração) poderia ter vindo com uma segunda embalagem para proteção contra agentes externos, sujeira seria um deles. Do resto chegou tudo certo.",4,0,3.79.0,2022-10-10 23:41:44,"Oi, Júlio. Sentimos muito por isso! Peço para que entre em contato com nosso time através deste link 👉(https://maga.lu/atendimento), é só copiar o mesmo e colar em seu navegador. Que lá eles vão te ajudar, ok?!",2022-10-11 13:49:46,most_relevant,com.luizalabs.mlapp
e3b2619d-d10c-4e24-9bc9-a972d24d491d,Alda Campos,https://play-lh.googleusercontent.com/a/AEdFTp4ng-M5OEUYGQHsJVCXKY-oFtf6IcX-whi-H2dF=mo,"Vocês não acham que o produto deve ser entregue e colocado no lugar que ficará? Eles não quiseram tirar a embalagem da geladeira porque não passava com a mesma, e deixaram no corredor. Na verdade , ela não passa com a embalagem mas passa sem a mesma, como ficaremos se não tivéssemos pessoas para ajudar-nos? Assinei o recibo sem ver o produto, graças a Deus estava perfeito e se um com defeito? Ficam estas interrogações qto a entrega. Obrigada valeu!",4,2,3.81.0,2022-11-19 10:32:43,"Oi, Alda. Sentimos muito por isso! Peço para que entre em contato com nosso time através deste link 👉(https://maga.lu/atendimento), é só copiar o mesmo e colar em seu navegador. Que lá eles vão te ajudar, ok?!",2022-11-21 12:06:15,most_relevant,com.luizalabs.mlapp
7330688d-f2ee-4a7e-ab0a-ac0f509c9c61,Luis Varela,https://play-lh.googleusercontent.com/a/AEdFTp7xcBUshgTd4vgi8AKKmAupUF4ZUA7rCNnpTGP_=mo,"Estou muito conforme com a logística e o acompanhamento pos venda, a empresa está de parabéns neste quesito. Contudo, sou comprador assíduo e tenho notado que o aviso de entrega do produto, chega antes que a entrega física do produto. Fica a dica para que possa se mudar essa situação.",4,0,3.81.0,2022-12-09 10:27:30,"Oi, Luis! Fiquei muito feliz em saber disso. O Time Magalu está sempre trabalhando pra oferecer cada vez mais agilidade para nossos clientes. Sua satisfação é muito importante. Pode contar sempre conosco, tá?!😊💙Magalu-Compras Online",2022-09-01 17:49:00,most_relevant,com.luizalabs.mlapp
dc71ee48-d7af-482d-b172-a8da1bb73768,Renan da Silva Araújo,https://play-lh.googleusercontent.com/a-/AD5-WClPIrDN4s8YAlnCT0eYPqlc9V0q8EzW2UOlzOKR,"Excelente app, porém fica meio confuso a maneira de avaliar os produtos comprados. Tb tive um problema com um produto comprado, porém resolvido com o lojista parceiro; abri uma solicitação de cancelamento, e , após resolvido o problema, não consegui cancelar a mesma solicitação.",4,2,3.81.0,2022-11-09 13:10:13,"Oi Renan. Sentimos muito por isso! Peço para que entre em contato com nosso time através deste link 👉(https://maga.lu/atendimento), é só copiar o mesmo e colar em seu navegador. Que lá eles vão te ajudar, ok? 💙 - Magalu - Compras Online
",2022-11-09 14:24:46,most_relevant,com.luizalabs.mlapp
