reviewId,userName,userImage,content,score,thumbsUpCount,reviewCreatedVersion,at,replyContent,repliedAt,sortOrder,appId
b5fb2723-665a-4e17-970c-2cdda22c3b75,Joice Soares,https://play-lh.googleusercontent.com/a-/AD5-WClmiUXf9TTCj6rpPF1DbOjs7L8kgzWIfzJSKT2GNQ,"Olha, os produtos são bons, mas algumas lojas desse aplicativo mentem, ficam mostrando que o frete é grátis, mas quando a gente vai comprar, o frete já não tá mais grátis. Façam o favor de só pôr frete grátis se realmente for🙄",2,0,3.81.0,2022-12-10 12:32:24,"Oi, Joice. Sentimos muito por isso! Peço para que entre em contato com nosso time através deste link 👉(https://maga.lu/atendimento), é só copiar o mesmo e colar em seu navegador. Que lá eles vão te ajudar, ok?!",2022-12-11 11:54:05,most_relevant,com.luizalabs.mlapp
9efda02f-f10f-4b44-af27-3940def5c13d,Luciene Ramos,https://play-lh.googleusercontent.com/a-/AD5-WCk_3-vCpv_3zqHxCBCMTgCke8DVaqVqm2O4OcKk,"Nunca tinha tido problemas com o App ,até a minha última compra que não recebi a nota fiscal e nem porque não conseguiram enviar meus produtos. Infelismente Tive que cancelar a compra. Não estou conseguindo adicionar outros produtos ao carinho 🥺",2,0,3.81.0,2022-12-03 00:37:22,"Oi, Luciene. Sentimos muito por isso! Peço para que entre em contato com nosso time através deste link 👉(https://maga.lu/atendimento), é só copiar o mesmo e colar em seu navegador. Que lá eles vão te ajudar, ok?!",2022-12-06 15:01:46,most_relevant,com.luizalabs.mlapp
fc19750d-26e0-4ca1-a794-e061693f507a,Macia Cristiane,https://play-lh.googleusercontent.com/a-/AD5-WCnx83uw2olyYlhnyY-pakuatHxxjJOsv_iv3bERTw,"Sempre compro no Magalu no entanto não consigo mais acessar minha conta só aparece a mensagem: ocorreu um erro inesperado. Já desinstalei, instalei novamente e nada. Simplesmente não tenho como acessar mais. Por gentileza resolvam isso!",2,0,3.81.0,2022-12-04 15:41:12,"Oi, Macia. Sentimos muito por isso! Peço para que entre em contato com nosso time através deste link 👉(https://maga.lu/atendimento), é só copiar o mesmo e colar em seu navegador. Que lá eles vão te ajudar, ok?!",2022-12-06 18:17:09,most_relevant,com.luizalabs.mlapp
0085aaba-a15a-43bf-b2bf-ea871fe075fe,Nadja Paula,https://play-lh.googleusercontent.com/a-/AD5-WCm9ARUxhTAzA_A-cG2VpbdZKNtrAkX1k-XfiDt0gfo,O app em si é bom mais deixo a desejar as parcerias com outras lojas que não tem compromisso com o cliente pois fiz uma compra no dia 26 hj dia 4 e o objeto não está em rota de entrega depois de muitos insistir foi que liberaram a nota fiscal 😡muitos chateada com a demora pra enviar o produto.,2,0,3.81.0,2022-12-04 05:14:12,"Oi, Nadja. Sentimos muito por isso! Peço para que entre em contato com nosso time através deste link 👉(https://maga.lu/atendimento), é só copiar o mesmo e colar em seu navegador. Que lá eles vão te ajudar, ok?!",2022-12-06 16:54:47,most_relevant,com.luizalabs.mlapp
637af5f4-c228-469e-8cf2-27bea9b858e2,Letícia Da Silveira Carlos,https://play-lh.googleusercontent.com/a/AEdFTp6MWOdtdPHSdcx5TPPi2QDAsp7Eu1m51HolYlbh=mo,"O app não está funcionando. Você entra, clica em algum produto ou tenta pesquisar e ele fecha. Não é possível verificar as promoções de Black Friday. Uma pena, vão deixar de vender.",2,0,3.81.0,2022-11-23 00:15:31,"Oi, Letícia. Sinto muito por isso. 😕 Dê uma olhadinha se o SuperApp Magalu está atualizado, caso sim, tente fazer a limpeza de cash. A memória cash são arquivos temporários que ficam armazenados no celular quando algum app é acessado. Se o problema continuar envie um e-mail pro atendimento.site@magazineluiza.com.br 😉 Magalu - Compras Online",2022-11-23 13:58:07,most_relevant,com.luizalabs.mlapp
83852954-4d14-41b0-aaaa-3a7a4c891ddf,Domingos B. Santos Júnior,https://play-lh.googleusercontent.com/a-/AD5-WCmqTb8DOAnKUo25KPbTZu7NIvT1qEc6AXp7hkKZ9w,"Na hora da compra, avisa que vai ser entregue em 2 dias úteis e opção de retirada na loja, Optei por 2 dias úteis, mas no final esperei mais 8 dias para ser entregue e foi solicitado 2 aparelhos e chegou 1 somente... Enfim nunca tive problema, mas dessa vez fiquei bem insatisfeito.",2,0,3.81.0,2022-12-10 13:58:24,"Oi, Domingos. Sentimos muito por isso! Peço para que entre em contato com nosso time através deste link 👉(https://maga.lu/atendimento), é só copiar o mesmo e colar em seu navegador. Que lá eles vão te ajudar, ok?!",2022-12-11 12:02:24,most_relevant,com.luizalabs.mlapp
83693b97-5225-4a51-b978-b7be48344338,Lenilson Bento,https://play-lh.googleusercontent.com/a-/AD5-WCmuMCjHo6AGorHBvmTbA6cynvl_-TMpvBTRRmaBtw,"O pior serviço de entrega de Salvador hoje na minha opinião. Todas as minhas experiências de compras com estresse na entrega: produtos que retornam pra São Paulo, produtos entregue na casa de estranhos ( que por sorte ainda me devolvem). Das 5 compras , nenhuma teve êxito na entrega. A mais recente,hoje foi parar em outro endereço. O estranho que nas Casas Bahia o produto chega aqui",2,0,3.81.0,2022-12-14 14:43:42,"Oi, Lenilson. Sentimos muito por isso! Peço para que entre em contato com nosso time através deste link 👉(https://maga.lu/atendimento), é só copiar o mesmo e colar em seu navegador. Que lá eles vão te ajudar, ok?!",2022-12-15 13:15:50,most_relevant,com.luizalabs.mlapp
7676b30f-651d-482e-9908-a0d6aeb055cd,Jonatha Matos,https://play-lh.googleusercontent.com/a-/AD5-WCkA-ox6fnTzVGaWOcYAVCRPo6ZVtWujaKuBCbvVswo,"Fica dando erro em minha conta, aparece promoção quando você vai finalizar a compra não tem mais sua numeração. Fora que quando liga para falar com algum atendente você pode ficar horas que não irão atender, só ficam fazendo marketing e """"promoções"""" mas resolver seu problema não resolvem",2,0,3.81.0,2022-12-16 13:15:32,"Oi, Jonatha. Sentimos muito por isso! Peço para que entre em contato com nosso time através deste link 👉(https://maga.lu/atendimento), é só copiar o mesmo e colar em seu navegador. Que lá eles vão te ajudar, ok?!",2022-12-18 11:47:39,most_relevant,com.luizalabs.mlapp
fff5bea5-afbb-4860-bd02-7e634e41b16d,Luis Cláudio Silveira Da Costa,https://play-lh.googleusercontent.com/a-/AD5-WCm9CQW3rKQKXiZsodbDY_dMUmYbjsBa73Hi_Ldj,"O app até que não é ruim, mais ruim mesmo é você comprar dois colchões em novembro de 2022 para ser entregue em janeiro de 2023 dá pra ir para o catar e voltar umas 200 vezes tá louco magazine Luiza assim você deixa de agregar mais vendas em sua plataforma digital.",2,0,3.81.0,2022-12-12 18:48:53,"Oi, Luis. Sentimos muito por isso! Peço para que entre em contato com nosso time através deste link 👉(https://maga.lu/atendimento), é só copiar o mesmo e colar em seu navegador. Que lá eles vão te ajudar, ok?!",2022-12-14 17:07:06,most_relevant,com.luizalabs.mlapp
e9e49427-9fe4-4d02-af58-ed4854116ed0,Josley Cardoso.,https://play-lh.googleusercontent.com/a-/AD5-WCnUrC1SrDmZAvqfUO0K-lmavYpkB2At5I9TKD72s5w,Infelizmente só ficou a desejar as compras com retirada na loja Infelizmente demora muito e quando compramos é porque precisamos das mercadorias e com a demora e depois o atraso comprei dia 18/11 e ficaram de entregar dia 02/12 más porque a transportadora fica mais tempo com à mercadoria do que necessário eu acho passa do dia acredito que todos os consumidores ficam muito insatisfeitos né kkk,2,0,3.81.0,2022-12-03 18:40:09,"Oi, Josley. Sentimos muito por isso! Peço para que entre em contato com nosso time através deste link 👉(https://maga.lu/atendimento), é só copiar o mesmo e colar em seu navegador. Que lá eles vão te ajudar, ok?!",2022-12-06 15:53:10,most_relevant,com.luizalabs.mlapp
dcb079f0-04e1-4b7d-8353-5c4616f4364a,Aline Silveira,https://play-lh.googleusercontent.com/a-/AD5-WCm01JqRY0K6ImR-Y1Vv5Uki6_E_7LAcKQLeo-SIcfU,"A transportadora q faz as entregas não é boa deixa para entregar os produtos na data final de prazo. Teve um tempo q comprar no magalu era ótimo pois no máximo 3 dias após a compra o pedido chegava, agora deixa a desejar.",2,0,3.81.0,2022-12-08 14:46:49,"Oi, Aline. Sentimos muito por isso! Peço para que entre em contato com nosso time através deste link 👉(https://maga.lu/atendimento), é só copiar o mesmo e colar em seu navegador. Que lá eles vão te ajudar, ok?!",2022-12-08 16:53:47,most_relevant,com.luizalabs.mlapp
1f9a9279-e183-4e8b-8f91-140933a2413f,Saulo Luz,https://play-lh.googleusercontent.com/a/AEdFTp7GAHcUbxpVIgFOGS4E_U7-1s4OJXuFeIi_lyfS=mo,"Infelizmente o app não tem acessível o campo de reclamações, apesar da entrega vir antes do prazo o produto veio arranhado e a empresa que realizou a entrega e lastimável, produto exposto e infelizmente não veio a nota fiscal do mesmo.",2,0,3.81.0,2022-12-02 09:14:53,"Oi, Saulo. Sentimos muito por isso! Peço para que entre em contato com nosso time através deste link 👉(https://maga.lu/atendimento), é só copiar o mesmo e colar em seu navegador. Que lá eles vão te ajudar, ok?!",2022-12-02 13:18:20,most_relevant,com.luizalabs.mlapp
5482a345-ef19-4806-9a1a-69253d909b1b,Antônio Gilberto Schmitz de Oliveira,https://play-lh.googleusercontent.com/a-/AD5-WCkiUYVTokB5g6LHO_Soi59SZ6dWDRzCzM9DjcocjA,"Acabo de chegar em casa, muito chateado, pois fui até a loja retirar a compra feita no site e os funcionários estavam baixando as cortinas, fechando a Loja. Implorei, pois viera de longe, e me responderam: ""Volta mais tarde, agora tem jogo!"" Absurdo, doideira, passaram dois anos com as portas fechadas (pandemia) e agora, em plena blitz de vendas, fecham as portas para ver jogo. Isto, definitivamente, enfraquece nossa relação comercial. Primeira providência minha é desinstalar o APP. Não me s",2,0,3.81.0,2022-11-28 16:55:30,"Oi, Antônio. Sentimos muito por isso! Peço para que entre em contato com nosso time através deste link 👉(https://maga.lu/atendimento), é só copiar o mesmo e colar em seu navegador. Que lá eles vão te ajudar, ok?!",2022-11-29 16:05:10,most_relevant,com.luizalabs.mlapp
eac8bd54-c300-4cfe-9164-f62897ac1bae,luzamita Guilherme,https://play-lh.googleusercontent.com/a-/AD5-WCkhISSpZqHHl1Xjz3lbpwAavtwCMgPnyadjo4Rp,"Não estou conseguindo realizar o cadastro! Coloco os dados tudo certinho,quando coloco pra continuar ,aparece que não foi possível realizar o cadastro,! Preciso de ajuda!",2,0,3.81.0,2022-11-23 20:14:22,"Oi, luzamita. Sentimos muito por isso! Peço para que entre em contato com nosso time através deste link 👉(https://maga.lu/atendimento), é só copiar o mesmo e colar em seu navegador. Que lá eles vão te ajudar, ok?!",2022-11-24 11:38:13,most_relevant,com.luizalabs.mlapp
50e772f7-efca-4e5c-8546-5a14161059a0,Marilene Mayrink,https://play-lh.googleusercontent.com/a/AEdFTp4xN-y_mRF0s5FyXEMQibO_ZcxOwIW40UYFq2wO=mo,"Boa tarde Comprei 4 relógios , recebi só 1. Gostaria de saber o que ocorreu. E não consegui responder a pesquisa, cliquei onde m indicaram mas cai em propagandas. Aguardo uma satisfação. Saudações de paz",2,0,3.81.0,2022-12-10 19:41:01,"Oi, Marilene. Sentimos muito por isso! Peço para que entre em contato com nosso time através deste link 👉(https://maga.lu/atendimento), é só copiar o mesmo e colar em seu navegador. Que lá eles vão te ajudar, ok?!",2022-12-11 13:03:43,most_relevant,com.luizalabs.mlapp
132242a5-c821-4c1b-ab65-c5e07360dcb7,Cristiane “Cris” Goncalves,https://play-lh.googleusercontent.com/a-/AD5-WClH-F5cQMMhwDcgVoCYupQRcrTR_GZwjm3kQTeB5A,Simplesmente perdi o número e mudei o e-mail liguei e avisei consegui atualizar o e-mail porém a mulher falou que o número eles não tem acesso pra mudar e que eu teria que mudar no aplicativo pois bem não consigo o aplicativo não aceita a atualização de outro número como pode isso eles tem acesso pode mudar o e-mail e não pode atualizar o número? Vou desinstalar e não compro mais nada infelizmente,2,0,3.81.0,2022-12-06 10:30:47,"Oi, Cristiane. Sentimos muito por isso! Peço para que entre em contato com nosso time através deste link 👉(https://maga.lu/atendimento), é só copiar o mesmo e colar em seu navegador. Que lá eles vão te ajudar, ok?!",2022-12-06 20:12:22,most_relevant,com.luizalabs.mlapp
920e0de6-4d48-49f2-9a67-21416766d08b,Heloisa flórida,https://play-lh.googleusercontent.com/a-/AD5-WCl7Lrm1tqjh6MmfTfXFMNmJe1JnqVzSVvvcxcF7XEU,"Os produtos são otimos,mas eles não cumprem o prazo de entrega, to com 3 pedidos atrasados agora saio pra viajar e os produtos, hein,qual a opção logística pra isso,nem recomendo mais",2,0,3.81.0,2022-12-10 11:00:12,"Oi, Heloisa. Sentimos muito por isso! Peço para que entre em contato com nosso time através deste link 👉(https://maga.lu/atendimento), é só copiar o mesmo e colar em seu navegador. Que lá eles vão te ajudar, ok?!",2022-12-11 11:51:14,most_relevant,com.luizalabs.mlapp
bd57b8aa-abc5-4cec-b11f-d5c262f45bf6,Lena Vieira,https://play-lh.googleusercontent.com/a-/AD5-WCkcoW5CUsvEUn_au4Whe7nwv3jE3fcSEUV1KBpQUbg,Já cansei de tanto tentar fazer outra senha o aplicativo não aceitou já tentei todos os meios não dá certo caramba o que significa isso perdi meu cadastro não sei por qual motivo.nao consigo acompanhar minhas compras preciso encontrar minha conta neste app .😡😡😡😡😡por resolver isso pra mim por favor aplicativo péssimo.ruim demais.,2,0,3.81.0,2022-11-23 20:30:36,"Oi, Lena. Sentimos muito por isso! Peço para que entre em contato com nosso time através deste link 👉(https://maga.lu/atendimento), é só copiar o mesmo e colar em seu navegador. Que lá eles vão te ajudar, ok?!",2022-11-24 11:40:33,most_relevant,com.luizalabs.mlapp
afb99d6e-3e6e-4ef3-96b7-69a941434ea1,Hitomi Nishi,https://play-lh.googleusercontent.com/a/AEdFTp4VRhAMNwmhckWhvzTZ2s3wto-PkBZfcSmS31J7=mo,"Já foi bom. Ñ gostei pois os locais da retirada ficam distantes e ultimamente ñ estão cumprindo o prazo da entrega!! Se a transportadora ñ consegue cumprir, tem q mudar!!!",2,0,3.81.0,2022-12-06 09:43:34,"Oi, Hitomi. Sentimos muito por isso! Peço para que entre em contato com nosso time através deste link 👉(https://maga.lu/atendimento), é só copiar o mesmo e colar em seu navegador. Que lá eles vão te ajudar, ok?!",2022-12-06 19:59:15,most_relevant,com.luizalabs.mlapp
5a286c61-d249-4e9d-8d46-f33a4da41855,Paulo Henrique,https://play-lh.googleusercontent.com/a-/AD5-WClsM6Owe298o5gSobMPU46kpdMLVtrfyqg3DJn_hvw,Poxa comprei uma televisão pra poder assistir a copa pq a minha pifou e me falar que iria chegar dia 24/11 mas agora veio outra mensagem com outro prazo de entrega de até o dia 30/11 poxa falta de respeito com o cliente que vou falar viu já foi muito boa a magazine mas agora fiquei decepcionado com isso vou ficar sem ver o jogo na minha casa por falta de compromisso da empresa,2,0,3.81.0,2022-11-25 14:39:35,"Oi, Paulo. Sentimos muito por isso! Peço para que entre em contato com nosso time através deste link 👉(https://maga.lu/atendimento), é só copiar o mesmo e colar em seu navegador. Que lá eles vão te ajudar, ok?!",2022-11-25 15:34:06,most_relevant,com.luizalabs.mlapp
4e727d10-6e92-4130-ad6a-e53ccec51db3,Carlos Antonio,https://play-lh.googleusercontent.com/a-/AD5-WClcNtqgSvSyL7s1ziYQlnCBrC6pdlfq-KaXlzRbEw,"Sempre comprei pelo app , achei ótimo , mas ultimamente está apresentando erros inesperado quando tento acessar o app, por isso eu não consigo comprar mais nada e nem acessar o meu perfil magalu e nem o magalu pay",2,0,3.81.0,2022-12-10 18:59:47,"Oi, Carlos. Sentimos muito por isso! Peço para que entre em contato com nosso time através deste link 👉(https://maga.lu/atendimento), é só copiar o mesmo e colar em seu navegador. Que lá eles vão te ajudar, ok?!",2022-12-11 12:49:54,most_relevant,com.luizalabs.mlapp
ca1b7afa-ed24-4bd3-afeb-3708048b64cc,Edja Amorim,https://play-lh.googleusercontent.com/a/AEdFTp4Jle1Kx4w1FSSKitKFiT95I8eI8zYxm8QcLII=mo,"Gosto muito do AP, porém fiz uma compra em própria cancelou , depois comprei novamente um vestido para minha filha, mais nem mesmo consigo visualizar o rastreio estou super chateada, pois já sou cliente faz um bom tempo",2,0,3.81.0,2022-12-02 15:32:25,"Oi, Edja. Sentimos muito por isso! Peço para que entre em contato com nosso time através deste link 👉(https://maga.lu/atendimento), é só copiar o mesmo e colar em seu navegador. Que lá eles vão te ajudar, ok?!",2022-12-06 13:39:36,most_relevant,com.luizalabs.mlapp
9d5759fa-d2d5-429f-b879-9e3c33da90d6,Ellen Cristine,https://play-lh.googleusercontent.com/a/AEdFTp6vMvR1nlIJshIPLVvwz8rxkFmIs77KN2XMOaNQ=mo,"Foi um ótimo aplicativo agora só dá erro e não consigo mais entrar...desinstalei e instalei de novo e deu o mesmo problema.já vi a mesma critica e a resposta foi para procurar a equipe, como procurar falar com a equipe de um aplicativo q não conecta.",2,0,3.81.0,2022-12-12 13:13:26,"Oi, Ellen. Sentimos muito por isso! Peço para que entre em contato com nosso time através deste link 👉(https://maga.lu/atendimento), é só copiar o mesmo e colar em seu navegador. Que lá eles vão te ajudar, ok?!",2022-12-14 16:28:49,most_relevant,com.luizalabs.mlapp
f5a272a1-93a2-479e-80cc-f41c75cdb01b,Luciano Guedes,https://play-lh.googleusercontent.com/a/AEdFTp5ckKfZM1gwg7eIborDkcAQZkdExxwkBrhmMMJ2=mo,"Fiz uma compra em uma loja parceira , não recebi no prazo e estou até agora sem resposta . A loja parceira falou que o produto já foi despachado pro magazine, mas não tenho suporte de nenhuma das partes mais.",2,0,3.81.0,2022-12-16 20:52:37,"Oi, Luciano. Sentimos por issomuito ! Peço para que entre em contato com nosso time através deste link 👉(https://maga.lu/atendimento), é só copiar o mesmo e colar em seu navegador. Que lá eles vão te ajudar, ok?!",2022-12-18 12:47:46,most_relevant,com.luizalabs.mlapp
df068ccd-41d9-4966-abb6-4c75154f6e4a,Simone Simeao,https://play-lh.googleusercontent.com/a/AEdFTp5WiSn35B_G7c-BDxavbR1DYfGgF-viBy6-cpdj=mo,"Bom dia e com muito pesar que estou decepcionada com o grupo magazine, pois paguei um frete para entregar na minha residência ,e o mesmo tive que retirar nos correios pagando um outro frete para buscá-lo.estou profundidade decepcionada .se vcs compradores como eu caso o entregador for os correios desfaz a compra pois o mesmo não entrega",2,0,3.81.0,2022-12-08 14:48:50,"Oi, Simone. Sentimos muito por isso! Peço para que entre em contato com nosso time através deste link 👉(https://maga.lu/atendimento), é só copiar o mesmo e colar em seu navegador. Que lá eles vão te ajudar, ok?!",2022-12-08 16:54:46,most_relevant,com.luizalabs.mlapp
5fa209db-708d-4c33-b966-5e7bee2e628d,Maisa Santana,https://play-lh.googleusercontent.com/a-/AD5-WCmOkI4WHeh5YQlZAnluVxx_KlkHNtVi0Jynvl4,"O app em si é bom... só não gostei da experiência da burocracia pra compra pela internet,muita demora no processo do pagamento 👎👎👎👎👎 péssimo,a Shoppe tá na frente de parabéns com a agilidade e eficácia em vendas pela internet,Magalu precisa ajeitar urgente isso aí 😒",2,0,3.81.0,2022-12-14 15:35:30,"Oi, Maisa. Sentimos muito por isso! Peço para que entre em contato com nosso time através deste link 👉(https://maga.lu/atendimento), é só copiar o mesmo e colar em seu navegador. Que lá eles vão te ajudar, ok?!",2022-12-15 13:36:49,most_relevant,com.luizalabs.mlapp
4fc5fbd8-664a-469e-9458-316d3555020a,Roberto Moreira,https://play-lh.googleusercontent.com/a/AEdFTp7z7ZNJHSHdQsmJT1PTWzZXDs1PMn4H8V10gG3d=mo,"Minhas últimas experiências só decepção. Um notebook que não funcionou de quase 3.000,00 e uma compra de wisky com propaganda de 1 L e recebi de 750ml. Desiludido com magalu. Perdi totalmente a confiança que tinha em comprar por esse app. Tô com prejuízo de mais de R$ 3.500 00.",2,0,3.81.0,2022-11-28 21:34:08,"Oi, Roberto. Sentimos muito por isso! Peço para que entre em contato com nosso time através deste link 👉(https://maga.lu/atendimento), é só copiar o mesmo e colar em seu navegador. Que lá eles vão te ajudar, ok?!",2022-11-25 13:30:46,most_relevant,com.luizalabs.mlapp
fa3b7ec1-79bc-4733-bf53-5944024a5f46,Walter José,https://play-lh.googleusercontent.com/a/AEdFTp4dP-yjm-HBarh1ejn722f7jb_8xcJo_x53CsmK=mo,"Já giz diversas compras pelo site e nao tive problemas. Ontem fiz uma compra, não consigo acessar a minha conta para verificar o status do pedido. 🤔",2,0,3.81.0,2022-12-06 21:49:15,"Oi, Walter. Sentimos muito por isso! Peço para que entre em contato com nosso time através deste link 👉(https://maga.lu/atendimento), é só copiar o mesmo e colar em seu navegador. Que lá eles vão te ajudar, ok?!",2022-12-07 11:25:50,most_relevant,com.luizalabs.mlapp
5ca37ccd-173d-4a33-b570-bd1b1214a200,Elaine Oliveira,https://play-lh.googleusercontent.com/a-/AD5-WCmP7noias21OpcNTmV7g7u-s-klIIu3qu74hwEl,"Já sou cliente há algum tempo, e hj recebi um pedido sem embalagem e nenhuma identificação da loja. Achei um absurdo Espero que não se repita, pq um simples saco não custa tanto. A encomenda foi entregue exposta e quem passava na rua estava vendo.",2,0,3.81.0,2022-11-21 19:22:57,"Oi, Elaine. Sentimos muito por isso! Peço para que entre em contato com nosso time através deste link 👉(https://maga.lu/atendimento), é só copiar o mesmo e colar em seu navegador. Que lá eles vão te ajudar, ok?!",2022-11-22 12:45:12,most_relevant,com.luizalabs.mlapp
05b693e7-22da-4c34-b9a2-60a2ddfdb6c9,Mayara Oliveira,https://play-lh.googleusercontent.com/a/AEdFTp72fwMS01N1NOwYrs-4Fbor0yTr6zMnf7tqLCYr=mo,"O app em si é ótimo. Só que na última compra que fiz constou que eu recebi minha entrega e isso não é verdade. Fiquei no prejuízo e nada fizerem ,estou chateada. Melhorem",2,0,3.81.0,2022-11-24 21:16:11,"Oi, Mayara. Sentimos muito por isso! Peço para que entre em contato com nosso time através deste link 👉(https://maga.lu/atendimento), é só copiar o mesmo e colar em seu navegador. Que lá eles vão te ajudar, ok?!",2022-11-25 11:43:06,most_relevant,com.luizalabs.mlapp
63fcbb25-271c-4485-9176-47ab10e4d018,Michael Duarte,https://play-lh.googleusercontent.com/a-/AD5-WCmMGJnmB-KQeesdslBiCKyHwpnFcA-hOcFTyUXiww,"Toda vez que tento login no app, acusa a mensagem ""Ocorreu um erro inesperado"". Já reinstalei o app e o problema persiste.",2,0,3.81.0,2022-12-14 12:13:40,"Oi, Michael. Sentimos muito por isso! Peço para que entre em contato com nosso time através deste link 👉(https://maga.lu/atendimento), é só copiar o mesmo e colar em seu navegador. Que lá eles vão te ajudar, ok?!",2022-12-15 13:08:44,most_relevant,com.luizalabs.mlapp
692fe2be-f728-4b83-bdcc-22ff9ca74dc0,Hugo Cardoso,https://play-lh.googleusercontent.com/a-/AD5-WCld8grYqoTTmtAiWeNJTgoGUzin4TG5gflHtKjweg,"O app é mto bom, porém depois que atualizou não quer mais deixar eu entrar na minha conta, só fala que ocorreu um erro inesperado e não entra na conta 👎👎",2,0,3.81.0,2022-12-14 04:03:06,"Oi, Hugo. Sentimos muito por isso! Peço para que entre em contato com nosso time através deste link 👉(https://maga.lu/atendimento), é só copiar o mesmo e colar em seu navegador. Que lá eles vão te ajudar, ok?!",2022-12-15 12:59:18,most_relevant,com.luizalabs.mlapp
6d86726e-39d9-4ca5-a8fe-4e9221d57333,Regina Mikaelly,https://play-lh.googleusercontent.com/a/AEdFTp428N4h2Guh4yFRKZ6zRMt9aEbU9DxFkzLDZggc=mo,"O preço dos produtos são bons, mas não compensa comprar um produto que o frete sai mais caro que o produto, as vezes deixo de comprar por conta do frete muito alto e o prazo de entrega também demora muito,acabo comprando em outros sites o mesmo produto. E a frequência de anúncios de produtos é muito alta, as vezes isso incomoda demais.",2,164,3.75.2,2022-08-16 16:10:10,"Oi, Regina. Vou te explicar como é feito o cálculo do frete, tá? O frete é calculado pelo peso, medidas e distância entre as regiões de entrega e do seu endereço. Por isso, em algumas situações o prazo e valor podem aumentar um pouquinho, viu? 💙 Magalu - Compras Online",2022-09-12 12:49:16,most_relevant,com.luizalabs.mlapp
988c1d96-82b2-463e-9a0d-a4e265034cee,Vanessa Galdino da Silva,https://play-lh.googleusercontent.com/a-/AD5-WCkK_0sGj-xTuY6_dWkTSDMDS9NP8BBH51zOl4ZR,O aplicativo ele é bom podia ser melhor se desse mais facilidade de resolver os problemas de produtos ruim as lojas São só para ser retirados pedidos eles nunca podem nos ajudar em nada e nem nos dar informações certas,2,0,3.81.0,2022-11-20 20:54:28,"Oi, Vanessa. Sentimos muito por isso! Peço para que entre em contato com nosso time através deste link 👉(https://maga.lu/atendimento), é só copiar o mesmo e colar em seu navegador. Que lá eles vão te ajudar, ok?!",2022-11-21 16:45:30,most_relevant,com.luizalabs.mlapp
2615356c-6c67-4b00-90bf-67b15e6d5a13,Jhenifer Vieira,https://play-lh.googleusercontent.com/a/AEdFTp5uGqSkpKgkOi1ma4TtRBTdMjQRvxEketQqT5eZ=mo,"O app é bom, mas não consigo acessar minha conta de maneira alguma. Só fica aparecendo ""ocorreu um erro inesperado"". Assim não sei nada sobre minha compra. Não consigo saber o número do pedido, acompanhar o pedido, nada!",2,1,3.79.0,2022-10-09 22:46:34,"Oi, Jhenifer. Sentimos muito por isso! Peço para que entre em contato com nosso time através deste link 👉(https://maga.lu/atendimento), é só copiar o mesmo e colar em seu navegador. Que lá eles vão te ajudar, ok?!",2022-10-10 15:18:45,most_relevant,com.luizalabs.mlapp
